{
 "_about": "spck.dev KNOWN ISSUES — the single source (PLAN-v3 §2.13, D5-07): every known upstream/program defect we publish, with a reproduction, per-cut status, origin, ledger anchor and clocks. Validated by conformance/ci/validate_known_issues.py (run_suite gate known-issues; ledger cross-ref when ops/ is mounted). Rendered by D5-12's generator in Wave 1; `refuted` rows never exist here (S8d stays in the ledger only). Per-cut status is re-verified by D4-05/D4-06 runs, never hand-edited.",
 "generated": "2026-09-10",
 "spec_pin": "cd78fb38e819de77d9b527d110476eccb876f1bd",
 "issues": [
  {
   "id": "KI-001",
   "artifact": "python-sdk",
   "component": "generated pydantic models (schema constraints)",
   "symptom": "ucp-sdk 0.5.0 drops four constraint families the pinned 08-25 schemas carry: JWK conditional rules (5), C62 scale, the maxProperties family, discriminator array-retyping. Every published cut predates the fixes.",
   "repro": {
    "command": "conformance/.sdk-venvs/ucp-sdk-tag/bin/python conformance/selfcheck/validate_dual_oracle.py --version 2026-08-25 --pydantic",
    "expected": "each pinned constraint rejects its negative payload",
    "observed": "the older named probe, conformance/selfcheck/sdk_constraints_probe.py, does NOT run against 0.5.0: it imports ucp_sdk.models.schemas.shopping.types.context, which moved to common.types.context when ucp#741 moved the shared types out of shopping. The gate above is what measures this every run; the 2026-10-09 nightly read pydantic-tag 0.5.0 agree 13, acknowledged drops 7, NEW 0, stale 0, expired 0. All four upstream fixes merged 2026-09-01 and 09-04 but the 0.5.0 tag was cut 2026-08-27, before them, so the tag still drops. See known_sdk_drops.json"
   },
   "status_by_cut": [
    {
     "cut": "PyPI ucp-sdk 0.5.0 (tag v2026-08-25, b6f9b91c)",
     "status": "open"
    },
    {
     "cut": "main 836b0228",
     "status": "fixed",
     "evidence": "python-sdk#89 #91 #93 merged (836b0228); ledger G1"
    }
   ],
   "origin": "theirs",
   "filed": [
    "https://github.com/Universal-Commerce-Protocol/python-sdk/pull/89",
    "https://github.com/Universal-Commerce-Protocol/python-sdk/pull/91",
    "https://github.com/Universal-Commerce-Protocol/python-sdk/pull/93"
   ],
   "re_verified": "2026-10-11",
   "confidence": "high",
   "ledger_row": "G1",
   "review_by": "2026-12-08",
   "refuted": false
  },
  {
   "id": "KI-002",
   "artifact": "js-sdk",
   "component": "writeCompatibilityDiscoverySchemas / declarations generator",
   "symptom": "npm @ucp-js/sdk 0.5.1 ships the extends-stub twin of the merged #55 fix (maxProperties / extends / declarations): generated compatibility discovery schemas are incomplete at the published cut.",
   "repro": {
    "command": "npm view @ucp-js/sdk version && grep -n extends node_modules/@ucp-js/sdk/dist/schemas/*.d.ts",
    "expected": "generated declarations carry the extends/maxProperties members",
    "observed": "0.5.1 lacks them; main has them"
   },
   "status_by_cut": [
    {
     "cut": "npm 0.5.1",
     "status": "open"
    },
    {
     "cut": "main 99572ca8",
     "status": "fixed",
     "evidence": "js-sdk#63 merged 2026-09-07 (99572ca8); ledger G3"
    }
   ],
   "origin": "theirs",
   "filed": [
    "https://github.com/Universal-Commerce-Protocol/js-sdk/pull/55",
    "https://github.com/Universal-Commerce-Protocol/js-sdk/pull/63"
   ],
   "re_verified": "2026-10-11",
   "confidence": "high",
   "ledger_row": "G3",
   "review_by": "2026-12-08",
   "refuted": false
  },
  {
   "id": "KI-003",
   "artifact": "js-sdk",
   "component": "UcpDiscoveryProfileSchema",
   "symptom": "UcpDiscoveryProfileSchema models `capabilities` as an ARRAY; the spec (2026-04-08 and 2026-08-25) defines a record keyed by reverse-domain capability name whose values are arrays.",
   "repro": {
    "command": "node -e \"const s=require('@ucp-js/sdk');console.log(JSON.stringify(s.UcpDiscoveryProfileSchema.shape.ucp.shape.capabilities._def.typeName))\"",
    "expected": "ZodRecord (object keyed by capability name)",
    "observed": "ZodArray at 0.5.1 (re-run 2026-10-11 against the published package: capabilities typeName ZodArray; spec_generated.js:1560 reads `capabilities: z.array(CapabilityDiscoverySchema)`)"
   },
   "status_by_cut": [
    {
     "cut": "npm 0.5.1",
     "status": "open"
    },
    {
     "cut": "main 44c448d",
     "status": "open"
    }
   ],
   "origin": "theirs",
   "filed": [],
   "re_verified": "2026-10-11",
   "confidence": "high",
   "ledger_row": "G5",
   "review_by": "2026-12-08",
   "refuted": false
  },
  {
   "id": "KI-004",
   "artifact": "ucp-schema",
   "component": "definition selection (--def) and --schema-local-base",
   "symptom": "Crate 1.4.1 and the pinned 9b5c3206 crash (exit 134) on 08-25 def-selection patterns (#45/#46 class); the post-#66 head b52518f5 fixes the crash but regresses --schema-local-base (base segment doubled; A/B proven, old Valid / head rc 2).",
   "repro": {
    "command": "echo '{\"handler_id\":\"h\",\"type\":\"card\"}' > inst.json && conformance/.vendor/ucp-schema/target/release/ucp-schema validate inst.json --op create --schema conformance/.vendor/ucp-2026-08-25/source/schemas/common/types/payment_instrument.json --def selected_payment_instrument",
    "expected": "a validation verdict",
    "observed": "exit 134 with a stack overflow abort in the main thread, on both the installed 1.4.1 and the vendored pinned build, re-run 2026-10-11 with the recipe recorded in ucp-schema#45. An earlier re-read of this row probed payment_split_payments.json --def dev.ucp.shopping.checkout, which is not the crash pattern and exits 1 with a clean validation error, and wrongly recorded the row as not reproducing"
   },
   "status_by_cut": [
    {
     "cut": "crate 1.4.1",
     "status": "open"
    },
    {
     "cut": "9b5c3206 (pinned)",
     "status": "open"
    },
    {
     "cut": "main b52518f5",
     "status": "fixed",
     "evidence": "ucp-schema#66 merged (b52518f5) fixes the crash; the --schema-local-base regression there is open (ledger G6, #72 pending)"
    }
   ],
   "origin": "theirs",
   "filed": [
    "https://github.com/Universal-Commerce-Protocol/ucp-schema/issues/70"
   ],
   "re_verified": "2026-10-11",
   "confidence": "high",
   "ledger_row": "G6",
   "review_by": "2026-12-08",
   "refuted": false
  },
  {
   "id": "KI-005",
   "artifact": "samples-python",
   "component": "checkout_service / test helpers (bare ShippingDestination)",
   "symptom": "Fresh-run CI breaks (117/257 at the former pin 00333a80; 2 OrderTest 500s at 01755bcc): a helper builds a bare ShippingDestination and checkout_service.py:532 raises. Fixed upstream by samples#220, merged 2026-10-01 as 667e7212.",
   "repro": {
    "command": "cd conformance/.vendor/samples/rest/python/server && uv run pytest -q",
    "expected": "all tests OK",
    "observed": "all tests OK at the current pin cdb291c4 (279 passed, 12 subtests, no 500s and no checkout_service reference); the former path rest/python is not a uv project root and never was; only rest/python/server carries a pyproject, at both the old and the new pin"
   },
   "status_by_cut": [
    {
     "cut": "samples 00333a80 (pinned)",
     "status": "open"
    },
    {
     "cut": "samples 01755bcc",
     "status": "open"
    },
    {
     "cut": "conformance#96 (helpers)",
     "status": "fixed",
     "evidence": "conformance#96 merged (FanouZeng-TT) for the helper half; samples#220 open for the service half; ledger G10"
    },
    {
     "cut": "samples cdb291c4 (pinned 2026-10-11)",
     "status": "fixed",
     "evidence": "samples#220 merged 2026-10-01 as 667e7212; at this pin the server suite is 279 passed with no 500s and the official crosscheck reads 77 tests 77 pass 0 fail, up from 75/2"
    }
   ],
   "origin": "shared",
   "filed": [
    "https://github.com/Universal-Commerce-Protocol/samples/issues/218",
    "https://github.com/Universal-Commerce-Protocol/samples/pull/220"
   ],
   "re_verified": "2026-10-11",
   "confidence": "high",
   "ledger_row": "G10",
   "review_by": "2026-12-08",
   "refuted": false
  },
  {
   "id": "KI-006",
   "artifact": "samples-node",
   "component": "production start path (npm start)",
   "symptom": "`npm start` runs dist/index.js, which tsc never emits (the entry lands at dist/src/index.js); running that directly fails ERR_MODULE_NOT_FOUND on extensionless relative imports, because package.json sets type module while tsconfig sets moduleResolution bundler. samples#58 closed 2026-04 unfixed.",
   "repro": {
    "command": "cd conformance/.vendor/samples/rest/nodejs && npm run build && npm start",
    "expected": "server listens",
    "observed": "re-run 2026-10-11 at pin cdb291c4: npm run build exits 0 and emits dist/src/index.js but no dist/index.js, so npm start throws; node dist/src/index.js fails ERR_MODULE_NOT_FOUND on dist/src/api/checkout. 39 extensionless relative imports across 13 emitted files (was 37)"
   },
   "status_by_cut": [
    {
     "cut": "samples 01755bcc",
     "status": "open"
    },
    {
     "cut": "samples cdb291c4",
     "status": "open"
    }
   ],
   "origin": "theirs",
   "filed": [
    "https://github.com/Universal-Commerce-Protocol/samples/issues/58"
   ],
   "re_verified": "2026-10-11",
   "confidence": "high",
   "ledger_row": "R21",
   "review_by": "2026-12-08",
   "refuted": false
  },
  {
   "id": "KI-007",
   "artifact": "official-conformance",
   "component": "integration_test_utils / DEFAULT_UCP_VERSION",
   "symptom": "The official conformance suite has zero 2026-08-25 coverage: DEFAULT_UCP_VERSION=\"2026-04-08\" (integration_test_utils.py:59), ucp-sdk==0.4.4 pin, HEAD predates the release.",
   "repro": {
    "command": "grep -n DEFAULT_UCP_VERSION conformance/.vendor/conformance/integration_test_utils.py",
    "expected": "a 2026-08-25 default or matrix",
    "observed": "\"2026-04-08\" only"
   },
   "status_by_cut": [
    {
     "cut": "conformance 016ecbc",